project_name,oneliner,project_namespace,project_url,topics,rubric,last_update,stargazers_count,dominating_languages,organization,languages,homepage,created,license,total_commits_last_year,last_issue_closed,issue_labels,good_first_issue,contributors,organization_avatar,funding
pvlib-python,A set of documented functions for simulating the performance of photovoltaic energy systems.,pvlib,https://github.com/pvlib/pvlib-python.git,"solar-energy,python,renewable-energy,renewables,photovoltaic",Photovoltaics and Solar Energy,"2021/10/28, 16:50:39",594,Python,pvlib,"Python,TeX,Cython",https://pvlib-python.readthedocs.io,"2015/02/17, 00:21:33",BSD-3-Clause,100,"2021/10/10, 18:21:05","api,bug,development_workflow,discussion,documentation,duplicate,easy,enhancement,good first issue,help wanted,installation,invalid,io,license,performance,question,Release,solarfx2,SPI,testing,wontfix",8,67,https://avatars.githubusercontent.com/u/11037261?v=4,
pvfactors,Open source view-factor model for diffuse shading and bifacial PV modeling.,SunPower,https://github.com/SunPower/pvfactors.git,"solar-energy,renewable-energy,python,bifacial",Photovoltaics and Solar Energy,"2021/10/28, 15:45:44",50,Python,SunPower,Python,http://sunpower.github.io/pvfactors/,"2018/05/14, 06:10:55",BSD-3-Clause,7,"2021/10/28, 15:49:55","bug,duplicate,enhancement,good first issue,help wanted,invalid,question,WIP,wontfix",0,4,https://avatars.githubusercontent.com/u/1341977?v=4,
PVMismatch,An explicit Python PV system IV & PV curve trace calculator which can also calculate mismatch.,SunPower,https://github.com/SunPower/PVMismatch.git,"numpy,scipy,python,solar,photovoltaic",Photovoltaics and Solar Energy,"2021/07/29, 09:33:38",51,Jupyter Notebook,SunPower,"Jupyter Notebook,Python,Makefile,Batchfile",http://sunpower.github.io/PVMismatch/,"2013/01/23, 00:26:43",BSD-3-Clause,2,"2021/03/26, 18:14:43","bug,documentation,duplicate,enhancement,help wanted,invalid,question,wishlist,wontfix",0,7,https://avatars.githubusercontent.com/u/1341977?v=4,
rdtools,An open source library to support reproducible technical analysis of time series data from photovoltaic energy systems.,NREL,https://github.com/NREL/rdtools.git,,Photovoltaics and Solar Energy,"2021/09/17, 23:38:31",99,Python,NREL,Python,https://rdtools.readthedocs.io/,"2016/11/18, 22:17:01",MIT,17,"2021/09/17, 23:38:32","APPROVED,bug,dependencies,duplicate,enhancement,Fixed in development branch,help wanted,invalid,Proposed API change,question,wontfix",0,10,https://avatars.githubusercontent.com/u/1906800?v=4,
elpv-dataset,A dataset of functional and defective solar cells extracted from EL images of solar modules.,zae-bayern,https://github.com/zae-bayern/elpv-dataset.git,"photovoltaic,solar-energy,solar-cells,machine-learning,computer-vision",Photovoltaics and Solar Energy,"2021/10/28, 05:40:14",84,Python,zae-bayern,Python,,"2018/03/07, 10:53:56",CUSTOM,1,"2021/04/17, 12:28:16","bug,duplicate,enhancement,good first issue,help wanted,invalid,question,wontfix",0,1,https://avatars.githubusercontent.com/u/37119743?v=4,
feedinlib,Contains implementations of photovoltaic models to calculate electricity generation from a PV installation based on given solar radiation. Furthermore it contains all necessary pre-calculations.,oemof,https://github.com/oemof/feedinlib.git,,Photovoltaics and Solar Energy,"2021/08/21, 07:58:55",64,Python,oemof,Python,,"2014/07/24, 09:03:29",MIT,43,"2021/10/12, 15:25:58","bug,documentation,duplicate,enhancement,help wanted,invalid,question,wontfix",0,10,https://avatars.githubusercontent.com/u/8503379?v=4,
pvcaptest,Collection of functions and Jupyter Notebooks to partially automate running a capacity test following ASTM E2848.,pvcaptest,https://github.com/pvcaptest/pvcaptest.git,,Photovoltaics and Solar Energy,"2021/07/26, 13:43:32",12,Python,pvcaptest,Python,,"2017/09/19, 01:33:23",MIT,40,"2021/07/25, 16:51:03","bug,data importing,docs,duplicate,enhancement,good first issue,help wanted,invalid,plotting,question,quick,testing,wontfix",0,2,https://avatars.githubusercontent.com/u/53880406?v=4,
pvtrace,Optical ray tracing for luminescent materials and spectral converter photovoltaic devices.,danieljfarrell,https://github.com/danieljfarrell/pvtrace.git,"python,photovoltaics,raytracing,optics,energy",Photovoltaics and Solar Energy,"2021/10/21, 22:41:14",78,Python,,Python,,"2011/01/05, 14:28:41",CUSTOM,6,"2021/02/18, 13:43:32","dependencies,help-wanted,pvtrace-2.2,pvtrace-2.3,pvtrace1.4,pvtrace2.0,to-do",0,5,https://avatars.githubusercontent.com/u/53880406?v=4,
SolarPILOT,Solar power tower layout and optimization tool.,NREL,https://github.com/NREL/SolarPILOT.git,,Photovoltaics and Solar Energy,"2021/09/17, 20:36:36",22,C++,,"C++,HTML,Python,Rich Text Format,CSS,C,CMake,Inno Setup,JavaScript,TeX,Makefile,Shell",https://www.nrel.gov/csp/solarpilot.html,"2017/03/24, 18:22:25",CUSTOM,22,"2021/09/17, 20:36:38","bug,duplicate,enhancement,help wanted,invalid,linux-support,needs-patch,question,ssc-change,wontfix",0,2,https://avatars.githubusercontent.com/u/53880406?v=4,
solar-data-tools,Data analysis tools for working with historical PV solar time-series data sets.,slacgismo,https://github.com/slacgismo/solar-data-tools.git,,Photovoltaics and Solar Energy,"2021/09/30, 21:46:59",24,Jupyter Notebook,slacgismo,"Jupyter Notebook,Python,Shell",,"2019/02/17, 00:28:25",BSD-2-Clause,174,"2021/10/13, 17:52:00","bug,duplicate,enhancement,good first issue,help wanted,invalid,question,wontfix",0,7,https://avatars.githubusercontent.com/u/19895500?v=4,
SolarPV-DER-simulation-utility,Allows user to run dynamics simulations for solar photovoltaic distributed energy resource connected to a stiff voltage source or to an external program.,tdcosim,https://github.com/tdcosim/SolarPV-DER-simulation-tool.git,,Photovoltaics and Solar Energy,"2021/09/16, 21:02:00",20,Python,tdcosim,Python,,"2019/03/19, 21:59:40",CUSTOM,41,"2021/09/09, 05:07:30","bug,duplicate,enhancement,good first issue,help wanted,invalid,question,wontfix",0,2,https://avatars.githubusercontent.com/u/52003368?v=4,
bifacial_radiance,Toolkit for working with RADIANCE for the ray-trace modeling of Bifacial Photovoltaics.,NREL,https://github.com/NREL/bifacial_radiance.git,"radiance,bifacial,photovoltaics,renewable-energy,renewables,gui",Photovoltaics and Solar Energy,"2021/10/25, 22:59:29",50,Python,tdcosim,"Python,C++,TeX,C,Makefile,Awk",https://bifacial-radiance.readthedocs.io,"2017/12/13, 17:56:18",BSD-3-Clause,4,"2021/10/28, 17:17:27","bug,contribution,dependencies,documentation,duplicate,enhancement,Fixed in development branch,gencumsky,geometry,good first issue,help wanted,HPC,invalid,JOSS,linux,Pvlib,question,v0_3_3,v0_3_4,v0_3_5,Wishlists,wontfix",0,6,https://avatars.githubusercontent.com/u/52003368?v=4,
autoXRD,"A Python package for automatic XRD pattern classification of thin-films, tweaked for small and class-imbalanced datasets.",PV-Lab,https://github.com/PV-Lab/autoXRD.git,,Photovoltaics and Solar Energy,"2021/10/13, 11:11:59",28,Python,PV-Lab,Python,,"2019/04/23, 19:15:53",Apache-2.0,0,"2021/10/28, 17:17:27","bug,duplicate,enhancement,good first issue,help wanted,invalid,question,wontfix",0,2,https://avatars.githubusercontent.com/u/13911947?v=4,
BayesProcess,A Python package for Physics informed Bayesian network inference using neural network surrogate model for matching process / variable / performance in solar cells.,PV-Lab,https://github.com/PV-Lab/BayesProcess.git,,Photovoltaics and Solar Energy,"2021/10/14, 11:55:30",23,Jupyter Notebook,PV-Lab,"Jupyter Notebook,Python",,"2019/07/09, 04:43:23",MIT,1,"2021/10/28, 17:17:27","bug,documentation,duplicate,enhancement,good first issue,help wanted,invalid,question,wontfix",0,2,https://avatars.githubusercontent.com/u/13911947?v=4,
solcore5,"A multi-scale, Python-based library for the modeling of solar cells and semiconductor materials.",qpv-research-group,https://github.com/qpv-research-group/solcore5.git,"photovoltaic,semiconductor,solar-cells,python,hacktoberfest",Photovoltaics and Solar Energy,"2021/10/24, 09:50:03",70,Python,qpv-research-group,"Python,Fortran",https://www.solcore.solar/,"2017/10/29, 20:13:23",CUSTOM,49,"2021/10/24, 09:49:58","bug,Documentation,duplicate,enhancement,good first issue,Hacktoberfest,hacktoberfest-accepted,help wanted,invalid,new feature,Next version,performance,question,wontfix",7,21,https://avatars.githubusercontent.com/u/48552948?v=4,
solax,Read energy usage data from the real-time API on Solax solar inverters.,squishykid,https://github.com/squishykid/solax.git,"solax,solar,photovoltaic,home-automation,iot,raspberry-pi",Photovoltaics and Solar Energy,"2021/10/14, 20:40:58",26,Python,,"Python,HTML",,"2019/04/09, 04:14:24",MIT,11,"2021/09/04, 11:21:01","bug,duplicate,enhancement,good first issue,help wanted,invalid,inverter:x1,inverter:x3,inverter:xhybrid,question,wontfix",0,4,https://avatars.githubusercontent.com/u/48552948?v=4,
solar,Allows for reproducible research both for photovoltaics systems performance and solar radiation.,oscarperpinan,https://github.com/oscarperpinan/solar.git,,Photovoltaics and Solar Energy,"2021/10/18, 22:50:23",30,R,,R,http://oscarperpinan.github.io/solar/,"2013/07/28, 14:14:41",GPL-3.0,4,"2020/05/24, 17:51:32","bug,duplicate,enhancement,invalid,question,wontfix",0,1,https://avatars.githubusercontent.com/u/48552948?v=4,
SolarTherm,Solar thermal power/fuel station performance simulation and optimization using Modelica.,SolarTherm,https://github.com/SolarTherm/SolarTherm.git,"engineering,energy,solar,thermodynamics,optimisation,simulation,modelica,modelica-library",Photovoltaics and Solar Energy,"2021/10/22, 12:59:09",20,Modelica,SolarTherm,"Modelica,Python,C,Shell",,"2015/07/21, 05:23:10",LGPL-3.0,430,"2021/10/22, 12:06:28","bug,duplicate,enhancement,help wanted,invalid,question,wontfix",0,8,https://avatars.githubusercontent.com/u/15701216?v=4,
LibreSolar,Firmware for LibreSolar BMS boards based on bq769x0 or ISL94202.,LibreSolar,https://github.com/LibreSolar/bms-firmware.git,,Photovoltaics and Solar Energy,"2021/10/16, 23:16:02",40,C,LibreSolar,"C,C++,CMake,Shell,Python",https://libre.solar/bms-firmware/,"2016/11/30, 11:19:50",Apache-2.0,57,"2021/08/12, 13:27:36","bug,duplicate,enhancement,help wanted,invalid,question,wontfix",0,4,https://avatars.githubusercontent.com/u/17674115?v=4,
Charge Controller Firmware,Firmware for LibreSolar MPPT/PWM charge controllers.,LibreSolar,https://github.com/LibreSolar/charge-controller-firmware.git,,Photovoltaics and Solar Energy,"2021/10/20, 12:32:13",84,C++,LibreSolar,"C++,C,CMake,Batchfile,Shell,Python",https://libre.solar/charge-controller-firmware/,"2016/08/02, 12:03:35",Apache-2.0,67,"2021/06/08, 08:32:06","bug,duplicate,enhancement,help wanted,invalid,question,wontfix",0,9,https://avatars.githubusercontent.com/u/17674115?v=4,
pvoutput,Python code for downloading PV data from PVOutput.org.,openclimatefix,https://github.com/openclimatefix/pvoutput.git,"pvoutput,python,python-library,solar,nowcasting",Photovoltaics and Solar Energy,"2021/10/22, 14:21:53",19,Python,openclimatefix,Python,,"2019/07/16, 16:51:03",Apache-2.0,17,"2021/01/11, 16:32:57","bug,documentation,duplicate,enhancement,good first issue,help wanted,invalid,question,Refactoring,testing,wontfix",1,3,https://avatars.githubusercontent.com/u/48357542?v=4,
predict_pv_yield,Use machine learning to map satellite imagery of clouds to solar PV yield.,openclimatefix,https://github.com/openclimatefix/predict_pv_yield.git,nowcasting,Photovoltaics and Solar Energy,"2021/10/27, 15:40:28",19,Jupyter Notebook,openclimatefix,"Jupyter Notebook,Python",,"2020/09/30, 16:46:56",MIT,238,"2021/10/22, 16:04:32","bug,data,discussion,documentation,duplicate,enhancement,good first issue,help wanted,infrastructure/aws,infrastructure/gcp,invalid,machine learning model,performance analysis: baselines & metrics,priority-high,priority-low,question,size-big,size-small,wontfix",1,2,https://avatars.githubusercontent.com/u/48357542?v=4,
solariot,Leverage your IoT enabled Solar PV Inverter to stream your solar energy usage data to a real time dashboard.,meltaxa,https://github.com/meltaxa/solariot.git,"freeboard,iot,solar-energy,sungrow-inverter,dashboard,pvoutput,modbus-sungrow,dweet,influxdb,telemetry",Photovoltaics and Solar Energy,"2021/10/27, 14:12:03",104,Python,,"Python,JavaScript,Dockerfile",https://solariot.live,"2017/09/15, 12:26:12",MIT,52,"2021/09/21, 01:29:21","bug,dependencies,duplicate,enhancement,good first issue,help wanted,invalid,question,wontfix",0,7,https://avatars.githubusercontent.com/u/48357542?v=4,
pvanalytics,"Quality control, filtering, feature labeling, and other tools for working with data from photovoltaic energy systems.",pvlib,https://github.com/pvlib/pvanalytics.git,,Photovoltaics and Solar Energy,"2021/07/05, 07:27:46",35,Python,,Python,https://pvanalytics.readthedocs.io,"2020/02/18, 17:10:34",MIT,19,"2021/05/13, 13:11:16","bug,ci,dependency,documentation,duplicate,enhancement,feature,good first issue,help wanted,invalid,question,tests,wontfix",0,5,https://avatars.githubusercontent.com/u/48357542?v=4,
IonMonger,A free and fast perovskite solar cell simulator with coupled ion vacancy and charge carrier dynamics in one dimension.,PerovskiteSCModelling,https://github.com/PerovskiteSCModelling/IonMonger.git,"perovskite-solar-cells,halide-ion-migration",Photovoltaics and Solar Energy,"2021/10/24, 04:17:41",16,MATLAB,PerovskiteSCModelling,"MATLAB,TeX",https://join.slack.com/t/perovskitescmodelling/shared_invite/zt-q51flyog-KCxed~m9hX_cijghKPGHIg,"2019/08/22, 10:21:56",AGPL-3.0,27,"2021/08/12, 17:32:10","bug,documentation,duplicate,enhancement,good first issue,help wanted,invalid,not a bug,question,wontfix",0,1,https://avatars.githubusercontent.com/u/45872822?v=4,
rayflare,"Provide a flexible, user-friendly Python environment to model complex optical stacks, with a focus on solar cells.",qpv-research-group,https://github.com/qpv-research-group/rayflare.git,"physics,optics,raytracing,ray-tracing,rigorous-coupled-wave,transfer-matrix-method,solar-cells,multiscale-simulation",Photovoltaics and Solar Energy,"2021/10/11, 18:49:00",4,Python,PerovskiteSCModelling,"Python,TeX",,"2019/06/12, 20:01:41",CUSTOM,117,"2021/10/11, 18:48:55","bug,documentation,duplicate,enhancement,good first issue,help wanted,invalid,question,wontfix",0,1,https://avatars.githubusercontent.com/u/45872822?v=4,
StatisticalClearSky,Statistical estimation of a clear sky signal from PV system power data.,slacgismo,https://github.com/slacgismo/StatisticalClearSky.git,,Photovoltaics and Solar Energy,"2021/09/30, 21:26:17",21,Jupyter Notebook,PerovskiteSCModelling,"Jupyter Notebook,Python,Shell",,"2018/01/15, 01:38:46",BSD-2-Clause,32,"2021/09/29, 22:10:47","bug,duplicate,enhancement,good first issue,help wanted,invalid,question,wontfix",0,5,https://avatars.githubusercontent.com/u/45872822?v=4,
Photovoltaic_Fault_Detector,Model-definition is a deep learning application for fault detection in photovoltaic plants.,RentadroneCL,https://github.com/RentadroneCL/Photovoltaic_Fault_Detector.git,"yolo3,detector-model,model-detection,detection-boxes,fault-detection,solar-energy,photovoltaic-panels,hacktoberfest,hacktoberfest2020",Photovoltaics and Solar Energy,"2021/08/26, 11:08:48",10,Jupyter Notebook,RentadroneCL,"Jupyter Notebook,HTML,Python",https://rentadrone.cl/developers/photovoltaic-fault-detector/,"2020/01/16, 13:50:45",GPL-3.0,25,"2020/12/18, 19:27:36","bug,dependencies,difficulty: entry level,difficulty: medium,difficulty: moderate,documentation,duplicate,enhancement,good first issue,hacktoberfest,help wanted,invalid,question,wontfix",2,4,https://avatars.githubusercontent.com/u/32961692?v=4,
nasapower,"Aims to make it quick and easy to automate downloading NASA-POWER global meteorology, surface solar energy and climatology data in your R session as a tidy data frame tibble object for analysis and use in modeling or other purposes.",ropensci,https://github.com/ropensci/nasapower.git,"agroclimatology,weather,r,nasa-power,nasa,agroclimatology-data,weather-variables,weather-data,earth-science,rstats,data-access,r-package",Photovoltaics and Solar Energy,"2021/10/28, 08:06:12",73,R,ropensci,"R,TeX",https://docs.ropensci.org/nasapower,"2017/11/02, 06:08:53",CUSTOM,285,"2021/09/13, 12:23:24","bug,duplicate,enhancement,good first issue,help wanted,invalid,question,Version 4.0,wontfix",0,2,https://avatars.githubusercontent.com/u/1200269?v=4,
pvcompare,A model for comparing the benefits of different PV technologies in a specified local energy system in different energy supply scenarios.,greco-project,https://github.com/greco-project/pvcompare.git,,Photovoltaics and Solar Energy,"2021/07/28, 07:50:42",10,Python,greco-project,"Python,Fortran,Shell",,"2019/11/28, 09:16:52",AGPL-3.0,1077,"2021/07/20, 14:27:30","bug,decision wanted,documentation,duplicate,enhancement,good first issue,help wanted,invalid,question,wontfix",0,5,https://avatars.githubusercontent.com/u/50671643?v=4,
SolTrace,A software tool developed at NREL to model concentrating solar power (CSP) systems and analyze their optical performance.,NREL,https://github.com/NREL/SolTrace.git,,Photovoltaics and Solar Energy,"2021/08/29, 13:12:46",23,C++,greco-project,"C++,TeX,Inno Setup,CMake,Makefile,Python",https://www.nrel.gov/csp/soltrace.html,"2017/06/29, 15:20:21",CUSTOM,3,"2021/08/06, 20:45:51","bug,documentation,duplicate,enhancement,help wanted,invalid,linux-support,question,wontfix",0,4,https://avatars.githubusercontent.com/u/50671643?v=4,
CarrierCapture.jl,A set of codes to compute carrier capture and recombination rates in semiconducting compounds like solar cells.,WMD-group,https://github.com/WMD-group/CarrierCapture.jl.git,"defects,semiconductors,electronic-structure,materials-design,solar-cells",Photovoltaics and Solar Energy,"2021/10/26, 02:19:02",24,Jupyter Notebook,WMD-group,"Jupyter Notebook,Julia,Python,TeX",https://wmd-group.github.io/CarrierCapture.jl/dev/,"2018/04/23, 12:10:13",MIT,13,"2021/05/06, 23:51:49","bug,duplicate,enhancement,good first issue,help wanted,invalid,question,wontfix",0,9,https://avatars.githubusercontent.com/u/1716969?v=4,
honeybee,"A Python library to create, run and visualize the results of daylight (RADIANCE) and energy analysis (EnergyPlus/OpenStudio).",ladybug-tools,https://github.com/ladybug-tools/honeybee.git,,Photovoltaics and Solar Energy,"2021/08/25, 05:31:45",87,Python,ladybug-tools,"Python,Shell,Dockerfile",http://ladybug-tools.github.io/honeybee/docs,"2015/12/24, 23:43:38",GPL-3.0,93,"2021/09/22, 08:09:13","[+],backlog,bug,core,critical,dependencies,discussion,done,duplicate,energyplus/openstudio,enhancement,good first issue,hacktoberfest,help wanted,honeybee,in progress,invalid,new development,not critical,py3,question,radiance,radiance-pmap,released,todo,triage,wish,wontfix",0,8,https://avatars.githubusercontent.com/u/14942270?v=4,
Open Solar Project,ESP32 Smart Solar Charger.,opensolarproject,https://github.com/opensolarproject/OSPController.git,,Photovoltaics and Solar Energy,"2021/10/26, 06:05:38",137,C++,opensolarproject,"C++,Python",https://github.com/opensolarproject/OSPController/wiki,"2019/08/09, 20:33:23",GPL-3.0,8,"2021/06/23, 13:14:04","bug,documentation,duplicate,enhancement,good first issue,help wanted,invalid,question,wontfix",0,2,https://avatars.githubusercontent.com/u/53953954?v=4,
MPPT-Solar-Charger,Supporting documentation and software for the MPPT Solar Charger.,danjulio,https://github.com/danjulio/MPPT-Solar-Charger.git,,Photovoltaics and Solar Energy,"2021/10/26, 19:08:34",68,C,,"C,C++,Assembly",,"2018/04/30, 04:48:29",GPL-3.0,2,"2021/01/10, 22:43:46","bug,duplicate,enhancement,good first issue,help wanted,invalid,question,wontfix",0,1,https://avatars.githubusercontent.com/u/53953954?v=4,
Tonatiuh,A Monte Carlo ray tracer for the optical simulation of solar concentrating systems.,iat-cener,https://github.com/iat-cener/tonatiuh.git,"solar-concentrating-systems,simulation,solar,energy",Photovoltaics and Solar Energy,"2021/10/20, 00:44:54",40,C++,iat-cener,"C++,QMake,Prolog,C,Batchfile",http://iat-cener.github.io/tonatiuh/,"2015/05/08, 10:51:30",GPL-3.0,0,"2020/12/18, 07:26:19","auto-migrated,bug,Component-Logic,Component-UI,duplicate,enhancement,help wanted,invalid,OpSys-All,OpSys-Linux,OpSys-Windows,Priority-Critical,Priority-High,Priority-Low,Priority-Medium,question,Type-Defect,Type-Enhancement,Type-Other,Usability,wontfix",0,5,https://avatars.githubusercontent.com/u/12331888?v=4,
PV4GER,Aims at democratizing and accelerating the access to photovoltaic systems data in Germany and beyond.,kdmayer,https://github.com/kdmayer/3D-PV-Locator.git,"neurips-2020,solar,renewable-energy,pv-systems,deepsolar,computer-vision,inception-v3,deeplabv3,network-planning,solar-panels,climate-change,ai",Photovoltaics and Solar Energy,"2021/10/11, 10:09:04",16,Python,,Python,,"2021/01/20, 12:47:54",MIT,93,"2021/05/24, 16:03:30","bug,documentation,duplicate,enhancement,good first issue,help wanted,invalid,question,wontfix",0,1,https://avatars.githubusercontent.com/u/12331888?v=4,
PV Free,A public API for PV modeling parameters.,BreakingBytes,https://github.com/BreakingBytes/pvfree.git,,Photovoltaics and Solar Energy,"2021/08/04, 06:21:30",15,Python,BreakingBytes,"Python,HTML",https://pvfree.herokuapp.com/,"2015/02/28, 08:09:30",BSD-2-Clause,4,"2021/03/25, 22:04:45","bug,dependencies,duplicate,enhancement,help wanted,invalid,question,wontfix",0,3,https://avatars.githubusercontent.com/u/1437576?v=4,
Pysolar,A collection of Python libraries for simulating the irradiation of any point on earth by the sun. It includes code for extremely precise ephemeris calculations.,pingswept,https://github.com/pingswept/pysolar.git,,Photovoltaics and Solar Energy,"2021/09/24, 17:09:47",273,Jupyter Notebook,,"Jupyter Notebook,Python",http://pysolar.org,"2008/03/01, 23:35:48",GPL-3.0,14,"2021/10/28, 19:24:20",help wanted,0,38,https://avatars.githubusercontent.com/u/1437576?v=4,
PV_ICE,"An open-source tool to quantify Solar Photovoltaics (PV) Energy and Mass Flows in the Circular Economy, from a Reliability and Lifetime approach.",NREL,https://github.com/NREL/PV_ICE.git,"circular-economy,circularity-metrics,reliability,solar-energy,circularity,mass-flow,repair,reuse,recycle,photovoltaics,lifetime",Photovoltaics and Solar Energy,"2021/09/24, 20:06:29",8,Python,,Python,https://PV_ICE.readthedocs.io,"2020/03/18, 21:31:34",CUSTOM,321,"2021/08/13, 14:34:08","bug,documentation,duplicate,enhancement,good first issue,help wanted,invalid,question,wishlist,wontfix",0,5,https://avatars.githubusercontent.com/u/1437576?v=4,
Solar electricity Nowcasting,Build the world's best near-term forecasting system for solar electricity generation.,openclimatefix,https://github.com/openclimatefix/nowcasting.git,nowcasting,Photovoltaics and Solar Energy,"2021/10/27, 10:51:47",14,TypeScript,,"TypeScript,JavaScript,CSS",https://openclimatefix.org/projects/nowcasting/,"2020/12/15, 15:40:01",MIT,20,"2021/10/13, 14:24:37","bug,discussion,documentation,duplicate,enhancement,good first issue,help wanted,infrastructure/aws,infrastructure/gcp,invalid,priority-high,priority-low,question,size-big,size-small,wontfix",0,3,https://avatars.githubusercontent.com/u/1437576?v=4,
Solar Forecast Arbiter,"Core data gathering, validation, processing, and reporting package for the Solar Forecast Arbiter.",SolarArbiter,https://github.com/SolarArbiter/solarforecastarbiter-core.git,,Photovoltaics and Solar Energy,"2021/10/28, 16:19:02",15,Python,SolarArbiter,"Python,Jinja,HTML,TeX,Dockerfile,C",https://solarforecastarbiter-core.readthedocs.io,"2019/01/23, 17:31:36",MIT,53,"2021/10/28, 16:19:00","api,bug,datamodel,dependencies,documentation,duplicate,enhancement,good first issue,help wanted,High Priority,infrastructure,invalid,IO,metrics,pvmodel,question,referencefx,reports,testing,trials,validation,wontfix",0,7,https://avatars.githubusercontent.com/u/43686373?v=4,
pv-system-profiler,Estimating PV array location and orientation from real-world power datasets.,slacgismo,https://github.com/slacgismo/pv-system-profiler.git,,Photovoltaics and Solar Energy,"2021/10/15, 10:45:29",6,Jupyter Notebook,SolarArbiter,"Jupyter Notebook,Python,Shell",,"2019/04/23, 18:33:36",BSD-2-Clause,425,"2021/10/13, 19:42:00","bug,duplicate,enhancement,good first issue,help wanted,invalid,question,wontfix",0,4,https://avatars.githubusercontent.com/u/43686373?v=4,
IEA-15-240-RWT,A 15 MW reference wind turbine repository developed in conjunction with IEA Wind.,IEAWindTask37,https://github.com/IEAWindTask37/IEA-15-240-RWT.git,,Wind Turbines,"2021/10/20, 10:43:32",107,Roff,IEAWindTask37,"Roff,Python,Scheme,F*",,"2019/10/08, 15:18:15",Apache-2.0,24,"2021/10/16, 10:14:39","bug,documentation,duplicate,enhancement,good first issue,help wanted,invalid,question,wontfix",0,9,https://avatars.githubusercontent.com/u/36546446?v=4,
windpowerlib,A library to model the output of wind turbines and farms.,wind-python,https://github.com/wind-python/windpowerlib.git,"wind,energy,power,model,modelling",Wind Turbines,"2021/10/22, 19:40:08",193,Python,wind-python,"Python,Jupyter Notebook",https://oemof.org/,"2016/08/26, 13:50:35",MIT,30,"2021/03/09, 20:32:12","API,bug,duplicate,enhancement,help wanted,invalid,nice-to-have,question,urgent,wontfix",0,8,https://avatars.githubusercontent.com/u/21263042?v=4,
turbinesFoam,A library for simulating wind and marine hydrokinetic turbines in OpenFOAM using the actuator line method.,turbinesFoam,https://github.com/turbinesFoam/turbinesFoam.git,"openfoam,turbines,airfoils,blade-element,actuator-line,wind-energy",Wind Turbines,"2021/09/13, 13:41:39",53,C++,turbinesFoam,"C++,C,Python,Roff,Shell",,"2014/06/24, 19:30:49",GPL-3.0,13,"2021/10/21, 13:59:10","bug,Caelus,documentation,duplicate,enhancement,help wanted,idea,in progress,invalid,question,ready,testing,wontfix",0,5,https://avatars.githubusercontent.com/u/10404114?v=4,
